### ISSUE TITLE
Single host setup does not work

### ISSUE THREAD

**Issue by dlifanov** [GluuFederation/gluu-docker#33]
BUG

1. run script ./gluu-docker/examples/single-host/run_all.sh
2. containers are created but all of them are in loop of waiting Consul

etcd container with port 8500 is reachable from all containers and there are some traffic between them in tcpdump

```
CONTAINER ID        IMAGE                                   COMMAND                  CREATED             STATUS              PORTS                                                                      NAMES
04d4831a85e6        gluufederation/nginx:3.1.2_dev          "/opt/scripts/wait..."   18 hours ago        Up 29 seconds       0.0.0.0:80->80/tcp, 0.0.0.0:443->443/tcp                                   nginx
4e62ccab6557        gluufederation/oxpassport:3.1.2_dev     "/opt/scripts/wait..."   18 hours ago        Up 2 minutes        8090/tcp                                                                   oxpassport
939078fb5e1d        gluufederation/oxauth:3.1.2_dev         "/opt/scripts/wait..."   18 hours ago        Up About a minute   8080/tcp                                                                   oxauth
0f8a3c7baed9        gluufederation/oxtrust:3.1.2_dev        "/opt/scripts/wait..."   18 hours ago        Up About a minute   8080/tcp                                                                   oxtrust
57b2f28475d2        consul                                  "docker-entrypoint..."   18 hours ago        Up 18 hours         8300-8302/tcp, 8301-8302/udp, 8600/tcp, 8600/udp, 0.0.0.0:8500->8500/tcp   consul
77f51f0f3449        gluufederation/opendj:3.1.2_dev         "/opt/scripts/wait..."   18 hours ago        Up About a minute                                                                              ldap
4597bb7e0465        gluufederation/oxshibboleth:3.1.2_dev   "/opt/scripts/wait..."   18 hours ago        Up About a minute   8080/tcp                                                                   oxshibboleth
```

```
 docker logs 04
2018-05-29 15:03:47,507 [INFO] [wait-for-it] - Hi world, waiting for Consul to be ready before running /opt/scripts/entrypoint.sh
2018-05-29 15:08:55,100 [ERROR] [wait-for-it] - Consul not ready, after 300 seconds.
2018-05-29 15:08:56,735 [INFO] [wait-for-it] - Hi world, waiting for Consul to be ready before running /opt/scripts/entrypoint.sh
2018-05-29 15:13:57,364 [ERROR] [wait-for-it] - Consul not ready, after 300 seconds.
2018-05-29 15:13:58,277 [INFO] [wait-for-it] - Hi world, waiting for Consul to be ready before running /opt/scripts/entrypoint.sh
2018-05-29 15:18:58,892 [ERROR] [wait-for-it] - Consul not ready, after 300 seconds.
2018-05-29 15:18:59,884 [INFO] [wait-for-it] - Hi world, waiting for Consul to be ready before running /opt/scripts/entrypoint.sh
2018-05-29 15:24:00,528 [ERROR] [wait-for-it] - Consul not ready, after 300 seconds.
```

```
2018-05-30 00:21:05,468 [INFO] [wait-for-it] - Hi world, waiting for Consul & LDAP to be ready before running /opt/scripts/entrypoint.sh
2018-05-30 00:21:05,470 [WARNING] [wait-for-it] - Consul not populated yet, waiting for key=gluu/config/oxauth_openid_jwks_fn
2018-05-30 00:21:10,479 [WARNING] [wait-for-it] - Consul not populated yet, waiting for key=gluu/config/oxauth_openid_jwks_fn
2018-05-30 00:21:15,487 [WARNING] [wait-for-it] - Consul not populated yet, waiting for key=gluu/config/oxauth_openid_jwks_fn
2018-05-30 00:21:20,495 [WARNING] [wait-for-it] - Consul not populated yet, waiting for key=gluu/config/oxauth_openid_jwks_fn
2018-05-30 00:21:25,504 [WARNING] [wait-for-it] - Consul not populated yet, waiting for key=gluu/config/oxauth_openid_j
```

```
tcpdump -i any -n port 8500
tcpdump: verbose output suppressed, use -v or -vv for full protocol decode
listening on any, link-type LINUX_SLL (Linux cooked), capture size 262144 bytes
11:49:21.624938 IP 172.18.0.3.45462 > 172.18.0.4.8500: Flags [P.], seq 4191934119:4191934300, ack 3044516497, win 346, options [nop,nop,TS val 16912889 ecr 16911637], length 181
11:49:21.624962 IP 172.18.0.3.45462 > 172.18.0.4.8500: Flags [P.], seq 0:181, ack 1, win 346, options [nop,nop,TS val 16912889 ecr 16911637], length 181
11:49:21.625219 IP 172.18.0.4.8500 > 172.18.0.3.45462: Flags [P.], seq 1:178, ack 181, win 352, options [nop,nop,TS val 16912889 ecr 16912889], length 177
11:49:21.625236 IP 172.18.0.4.8500 > 172.18.0.3.45462: Flags [P.], seq 1:178, ack 181, win 352, options [nop,nop,TS val 16912889 ecr 16912889], length 177
11:49:21.625297 IP 172.18.0.3.45462 > 172.18.0.4.8500: Flags [.], ack 178, win 354, options [nop,nop,TS val 16912889 ecr 16912889], length 0
11:49:21.625313 IP 172.18.0.3.45462 > 172.18.0.4.8500: Flags [.], ack 178, win 354, options [nop,nop,TS val 16912889 ecr 16912889], length 0
11:49:21.631752 IP 172.18.0.6.50408 > 172.18.0.4.8500: Flags [P.], seq 4131125301:4131125482, ack 1188845966, win 354, options [nop,nop,TS val 16912891 ecr 16912139], length 181
11:49:21.631768 IP 172.18.0.6.50408 > 172.18.0.4.8500: Flags [P.], seq 0:181, ack 1, win 354, options [nop,nop,TS val 16912891 ecr 16912139], length 181
11:49:21.631979 IP 172.18.0.4.8500 > 172.18.0.6.50408: Flags [P.], seq 1:178, ack 181, win 361, options [nop,nop,TS val 16912891 ecr 16912891], length 177
11:49:21.631995 IP 172.18.0.4.8500 > 172.18.0.6.50408: Flags [P.], seq 1:178, ack 181
```
Port 8500 was added manually to docker-compose.yml for debug

![screenshot from 2018-05-29 18 35 38](https://user-images.githubusercontent.com/24428929/40713331-5c9ec78c-6408-11e8-80e6-e6b166cb37c9.png)
![screenshot from 2018-05-29 18 36 45](https://user-images.githubusercontent.com/24428929/40713366-6c8ff8b4-6408-11e8-8e3a-476c2eedd263.png)

**Comment by dlifanov** [comment]
Firewall issue
